{
  "id": 1,
  "name": "Level 1",
  "subtitle": "Der Anfang",

  "world": {
    "width": 3200,
    "height": 600,
    "bgColor": "0x5c94fc",
    "groundColor": "0x228B22",
    "platformColor": "0x8B4513",
    "cloudCount": 18,
    "starCount": 0
  },

  "physics": {
    "gravity": 600,
    "playerSpeed": 220,
    "jumpPower": 480
  },

  "player": {
    "startX": 120,
    "startY": 520,
    "lives": 3
  },

  "platforms": [
    { "x": 300,  "y": 420, "tiles": 4, "type": "grass"  },
    { "x": 600,  "y": 340, "tiles": 3, "type": "stone"  },
    { "x": 900,  "y": 260, "tiles": 5, "type": "grass"  },
    { "x": 1200, "y": 380, "tiles": 3, "type": "wood"   },
    { "x": 1500, "y": 300, "tiles": 4, "type": "stone"  },
    { "x": 1800, "y": 220, "tiles": 3, "type": "ice"    },
    { "x": 2100, "y": 350, "tiles": 5, "type": "grass"  },
    { "x": 2400, "y": 280, "tiles": 4, "type": "wood"   },
    { "x": 2700, "y": 200, "tiles": 3, "type": "stone"  },
    { "x": 3000, "y": 320, "tiles": 4, "type": "ice"    }
  ],

  "coins": [
    { "x": 380,  "y": 380 },
    { "x": 460,  "y": 380 },
    { "x": 660,  "y": 300 },
    { "x": 960,  "y": 220 },
    { "x": 1280, "y": 340 },
    { "x": 1580, "y": 260 },
    { "x": 1880, "y": 180 },
    { "x": 2180, "y": 310 },
    { "x": 2480, "y": 240 },
    { "x": 2780, "y": 160 }
  ],

  "enemies": [
    { "x": 450,  "y": 396, "patrolLeft": 310,  "patrolRight": 570,  "speed": 80 },
    { "x": 950,  "y": 236, "patrolLeft": 910,  "patrolRight": 1170, "speed": 90 },
    { "x": 1550, "y": 276, "patrolLeft": 1510, "patrolRight": 1750, "speed": 100 },
    { "x": 2150, "y": 326, "patrolLeft": 2110, "patrolRight": 2420, "speed": 85 },
    { "x": 2750, "y": 176, "patrolLeft": 2710, "patrolRight": 2890, "speed": 110 }
  ],

  "goal": {
    "x": 3100,
    "y": 537
  },

  "locked": false
}
